{
  "$schema": "http://json-schema.org/draft-07/schema#",
  "$id": "https://transiteye.city/schemas/incident.schema.json",
  "title": "TransitEye Incident Schema",
  "description": "Schema for traffic violations, safety hazards, and ANPR incident records",
  "type": "object",
  "required": [
    "id",
    "plate_text",
    "plate_confidence",
    "trigger_reason",
    "location",
    "bus_id",
    "timestamp"
  ],
  "properties": {
    "id": {
      "type": "string",
      "description": "Unique identifier for the incident record"
    },
    "plate_text": {
      "type": "string",
      "minLength": 1,
      "description": "Recognized vehicle license plate characters or UNKNOWN"
    },
    "plate_confidence": {
      "type": "number",
      "minimum": 0.0,
      "maximum": 1.0,
      "description": "OCR confidence score for the license plate extraction"
    },
    "trigger_reason": {
      "type": "string",
      "minLength": 1,
      "description": "Violation or hazard trigger (e.g. bus_lane_violation, reckless_overtake, red_light)"
    },
    "location": {
      "$ref": "common.schema.json#/definitions/location"
    },
    "clip_url": {
      "type": ["string", "null"],
      "description": "URI or storage key for associated video/evidence clip snippet"
    },
    "bus_id": {
      "$ref": "common.schema.json#/definitions/bus_id"
    },
    "timestamp": {
      "$ref": "common.schema.json#/definitions/timestamp"
    },
    "metadata": {
      "type": "object",
      "description": "Additional context (e.g. vehicle category, relative speed, lane identifier)"
    }
  },
  "additionalProperties": false
}
